{
  "settingId": "spuk_im_schlosskeller",
  "bereich": "erzaehler",
  "hinweis": "Finale im Pfad ahmet: finale.ahmet.<ende> (4) und rueckblende.ahmet.",
  "eintraege": [
    {
      "id": "finale.ahmet.ende_meister",
      "text": "Das Geburtstagskind hat die Spuren sauber zusammengetragen. Ahmet gesteht: Die Tat war Panik im Dunkeln. Im Wachs am Griff des Kerzenständers klebt eine abgerissene Ecke vom Umschlag mit dem Mietgeld. Statt zuzugeben, dass er beim Essen viel zu groß bestellt hat, sammelte er von allen hundertfünfzig Euro Miete ein. Das Geburtstagskind findet den Schlüsselbund in der Innentasche von Ahmets Jacke, am Jackenständer im Ostsaal. Lejla und Ahmet sind zusammen aufgewachsen, doch die Runde bleibt beieinander. Herr Schneider überlebt; er wacht auf, hat eine Beule und eine Gedächtnislücke, und es geht ihm bald wieder gut. Am Morgen schließt Herr Schneider mit seinem Bund das Außentor auf. Die Runde lacht erleichtert, bei Tee und alkoholfreiem Apfelpunsch."
    },
    {
      "id": "finale.ahmet.ende_teilerfolg",
      "text": "Ahmet gesteht: Die Tat war Panik im Dunkeln. Die Runde ist erleichtert, aber ein gutes Stück Glück war auch dabei. Den Schlüsselbund findet in der Nacht niemand. Herr Schneider überlebt; er wacht auf, hat eine Beule und eine Gedächtnislücke, und es geht ihm bald wieder gut. Um sieben Uhr kommt Herrn Schneiders Kollegin mit dem Ersatzschlüssel und schließt das Außentor auf. Zwischen den Freunden bleibt ein Kratzer. Herr Schneider ist schon wieder grantig, vor allem wegen des Geldes. Alle gehen hinaus, ein bisschen stiller als am Abend."
    },
    {
      "id": "finale.ahmet.ende_justizirrtum",
      "text": "Das Geburtstagskind klagt die falsche Person an. Wer zu Unrecht beschuldigt wurde, ist entsetzt und wütend. Die Runde sitzt danach geteilt da, und die Stimmung wird kalt. Herr Schneider überlebt; er wacht auf, hat eine Beule und eine Gedächtnislücke, und es geht ihm bald wieder gut. Erst am Morgen wird Ahmet entdeckt: Der Schlüsselbund steckt in der Innentasche seiner Jacke am Jackenständer im Ostsaal. Ahmet gesteht: Die Tat war Panik im Dunkeln. Dann schließt Herr Schneider mit seinem Bund das Außentor auf, und alle gehen hinaus. Zwischen den Freunden bleibt trotzdem ein tiefer Riss."
    },
    {
      "id": "finale.ahmet.ende_eskalation",
      "text": "Das Geburtstagskind zeigt auf die falsche Person, und plötzlich reden alle durcheinander. Wer zu Unrecht beschuldigt wurde, brüllt zurück. Die Stimmen werden immer lauter, und keiner hört mehr zu. Die Runde zerfällt in kleine Grüppchen, und keiner glaubt dem anderen etwas. Herr Schneider überlebt; er wacht auf, hat eine Beule und eine Gedächtnislücke, und es geht ihm bald wieder gut. Ahmet gesteht erst später: Die Tat war Panik im Dunkeln. Um sieben Uhr kommt Herrn Schneiders Kollegin mit dem Ersatzschlüssel und schließt das Außentor auf. Alle gehen hinaus, und keiner verabschiedet sich."
    },
    {
      "id": "rueckblende.ahmet",
      "text": "Zwei vor zwölf gibt es einen Knall, und die Hauptsicherung fliegt raus. Überall ist es dunkel, nur die Kerzen an der Anrichte leuchten. Aus dem Vorratsraum springt Can, eine leuchtende Maske in der Hand. Herr Schneider packt ihn an der Kapuze und ruft: „Hab ich dich!“ Can reißt sich los und rennt davon. Gleich darauf packt Herr Schneider Ahmet am Arm und zischt: „Um zwölf erfahren's alle.“ Dann, in Panik: ein dumpfer Schlag, Poltern, Metall scheppert über den Steinboden. Der Schlüsselbund wandert in die Innentasche von Ahmets Jacke, die am Jackenständer im Ostsaal hängt. Um Mitternacht schaltet Tim die Hauptsicherung wieder ein, und das Licht geht an."
    }
  ]
}
