{
  "settingId": "spuk_im_schlosskeller",
  "bereich": "erzaehler",
  "hinweis": "Intro-Fassung 2",
  "eintraege": [
    {
      "id": "intro.start",
      "text": "Ein altes Schloss, etwas abgelegen vor der Stadt. Heute Abend wird hier Geburtstag gefeiert, und zwar im großen Gewölbekeller unter dem Schlossturm. Der Wind pfeift durch die Lichtschächte, und schwere Holztüren quietschen im Luftzug. Gruselig, aber gemütlich. Das Buffet ist eröffnet: warmes Essen, Brot, Dips und Gebäck. Kurz vor Mitternacht knallt es, dann ist es stockdunkel. Herr Schneider liegt bewusstlos im Vorratsraum gleich hinter der Tür. Der Schlüsselbund ist weg, und das Außentor ist zu. Hinter den dicken Mauern gibt es keinen Handyempfang, und ihr sitzt bis zum Morgen fest."
    },
    {
      "id": "intro.lacher.lacher_ruestung.besetzt",
      "text": "Um neun Uhr abends hielt Sibel die alte Ritterrüstung im Turmgang für einen Menschen. Sie schrie auf und stolperte rückwärts gegen die Schauvitrine. Die Scheibe bekam einen feinen Sprung."
    },
    {
      "id": "intro.lacher.lacher_ruestung.npc",
      "text": "Um neun Uhr abends hielt ein Gast die alte Ritterrüstung im Turmgang für einen Menschen. Der Gast schrie auf und stolperte rückwärts gegen die Schauvitrine. Die Scheibe bekam einen feinen Sprung."
    },
    {
      "id": "intro.lacher.lacher_verlaufen.besetzt",
      "text": "Um Viertel nach acht abends suchte Olli die Toilette. Er nahm die falsche Tür hinter der Theke und stand im dunklen Vorratsraum vor der Geburtstagstorte. „Ich wollte nur aufs Klo!“"
    },
    {
      "id": "intro.lacher.lacher_verlaufen.npc",
      "text": "Um Viertel nach acht abends suchte ein Gast die Toilette. Der Gast nahm die falsche Tür hinter der Theke und stand im dunklen Vorratsraum vor der Geburtstagstorte. „Ich wollte nur aufs Klo!“"
    },
    {
      "id": "intro.lacher.lacher_kamin.besetzt",
      "text": "Hana feuerte den Kamin an, ohne die Kaminklappe zu öffnen. Um halb zwölf abends füllte dichter Qualm den Kaminsaal. Alle husteten, die Klappen der Lichtschächte wurden aufgerissen, und das Feuer wurde gelöscht."
    },
    {
      "id": "intro.lacher.lacher_kamin.npc",
      "text": "Ein Gast feuerte den Kamin an, ohne die Kaminklappe zu öffnen. Um halb zwölf abends füllte dichter Qualm den Kaminsaal. Alle husteten, die Klappen der Lichtschächte wurden aufgerissen, und das Feuer wurde gelöscht."
    },
    {
      "id": "intro.auftrag.m",
      "text": "Eigentlich ist heute dein Geburtstag, und jetzt bist du auch noch der Detektiv. Herr Schneider bittet dich: „Finde raus, wer das war. Bis zum Morgen.“"
    },
    {
      "id": "intro.auftrag.w",
      "text": "Eigentlich ist heute dein Geburtstag, und jetzt bist du auch noch die Detektivin. Herr Schneider bittet dich: „Finde raus, wer das war. Bis zum Morgen.“"
    }
  ]
}
