{
  "settingId": "spuk_im_schlosskeller",
  "bereich": "erzaehler",
  "hinweis": "Finale im Pfad fatma: finale.fatma.<ende> (4) und rueckblende.fatma.",
  "eintraege": [
    {
      "id": "finale.fatma.ende_meister",
      "text": "Du klagst Fatma an, und es stimmt. Du hast die Spuren gut zusammengetragen. Fatma gesteht: Die Tat war Panik im Dunkeln. Sie wollte die Verzierungen zu Hause abzeichnen und die Schatulle am Montag zurückbringen. Zusammen seht ihr euch ihren breiten Silberring an. In einer Kerbe des Rings steckt frischer, goldgelber Messingabrieb. Fatma gibt den Schlüsselbund heraus, den sie in der Brottasche auf dem linken Buffettisch versteckt hat. Herr Schneider überlebt. Er wacht auf, hat eine Beule und eine Gedächtnislücke. Er ist schon bald wieder grantig. Emine ist seit der Schulzeit Fatmas beste Freundin, und daran ändert diese Nacht nichts. Die Runde lacht erleichtert, bei Tee und alkoholfreiem Apfelpunsch. Herr Schneider will das Außentor erst im Hellen aufschließen. Bis es dämmert, gibt es Torte und Tee. Dann schließt er auf, und ihr geht hinaus."
    },
    {
      "id": "finale.fatma.ende_teilerfolg",
      "text": "Du zeigst auf Fatma, und die Anklage stimmt. Fatma gesteht: Die Tat war Panik im Dunkeln. Ein gutes Stück Glück war dabei. Fatma gibt den Schlüsselbund aus der Brottasche auf dem linken Buffettisch heraus. Herr Schneider überlebt. Er wacht auf, hat eine Beule und eine Gedächtnislücke. Er ist schon bald wieder grantig. Zwischen den Freunden bleibt ein kleiner Riss. Herr Schneider will das Außentor erst im Hellen aufschließen. Bis es dämmert, gibt es Torte und Tee. Dann schließt er auf, und alle gehen hinaus, ein bisschen stiller als am Abend."
    },
    {
      "id": "finale.fatma.ende_justizirrtum",
      "text": "Du klagst die falsche Person an. Wer zu Unrecht beschuldigt wurde, ist entsetzt und wütend. Die Runde sitzt danach geteilt da, und die Stimmung wird kalt. Herr Schneider überlebt. Er wacht auf, hat eine Beule und eine Gedächtnislücke. Er ist schon bald wieder grantig. Das Tor bleibt zu bis zum Morgen. Um sieben Uhr schließt Herrn Schneiders Kollegin mit dem Ersatzschlüssel das Außentor auf. Erst danach gesteht Fatma: Die Tat war Panik im Dunkeln. Dann gehen alle hinaus. Zwischen den Freunden bleibt ein tiefer Riss."
    },
    {
      "id": "finale.fatma.ende_eskalation",
      "text": "Du zeigst auf die falsche Person, und plötzlich reden alle durcheinander. Wer zu Unrecht beschuldigt wurde, wehrt sich laut. Die Stimmen werden lauter, und keiner hört mehr zu. Die Runde zerfällt in kleine Grüppchen, und keiner glaubt dem anderen etwas. Herr Schneider überlebt. Er wacht auf, hat eine Beule und eine Gedächtnislücke. Er ist schon bald wieder grantig. Das Tor bleibt zu bis zum Morgen. Um sieben Uhr schließt Herrn Schneiders Kollegin mit dem Ersatzschlüssel das Außentor auf. Erst danach gesteht Fatma: Die Tat war Panik im Dunkeln. Dann gehen alle hinaus, und keiner verabschiedet sich."
    },
    {
      "id": "rueckblende.fatma",
      "text": "Zwei vor zwölf gibt es einen Knall, und die Hauptsicherung fliegt raus. Überall ist es dunkel, nur die Kerzen an der Anrichte und das grüne Notausgangsschild leuchten. Can springt mit der leuchtenden Maske aus dem Vorratsraum, Herr Schneider packt ihn an der Kapuze und ruft: „Hab ich dich!“ Fatma geht durch die Theken-Klappe zur Vorratstür und hält dort die Münzschatulle in der Hand. Herr Schneider packt den Gurt von Fatmas Tasche und zischt: „Zu spät. Die Polizei kommt so oder so.“ Dann, in Panik: ein dumpfer Schlag, Poltern, Metall scheppert über den Steinboden. Fatmas breiter Silberring schrammt über das Messing, und rote Wachstropfen fallen auf die Münzschatulle. Gleich darauf reißt sie den Bund vom Gürtel und steckt ihn in die Brottasche auf dem linken Buffettisch. Um Mitternacht schaltet Tim die Hauptsicherung wieder ein, und das Licht geht an."
    }
  ]
}
